{
  "schema_version": 2,
  "hash_algorithm": "codex-is-package-sha256-v2",
  "skill_id": "scene-storyboard-grid",
  "status": "published",
  "validator_version": "2.0.0",
  "approved_by": "user",
  "validated_at": "2026-08-16T09:45:12.616803+00:00",
  "sources": [
    {
      "name": "Codex_IS_搭建蓝图.md",
      "sha256": "a5653bc46d19c7a70f59ef05e0fb5a9a4dad8ed6abf3c708b5fd0ae84a29463a"
    }
  ],
  "intake_report_sha256": "a72fa5ac0db85c813e61d2f131c2ec8676b929dbef3ebe188077eda980e9ad99",
  "reviewed_core_sha256": "caa02e3d60a1797f1c9a58fb9038341c92967c1703eb6d27bdc00404b424ab12",
  "package_sha256": "15c4f0abc01a069d7fe9c06cb22755c97ea877188933557303bba20685b7da9d"
}
